{
  "version": "v5",
  "review_id": "<item>",
  "base_sha": "<base>",
  "head_sha": "<head>",
  "merge_base_sha": "<base>",
  "findings": [
    {
      "id": "<item>",
      "review_id": "<item>",
      "category": "rule_violation",
      "severity": "medium",
      "path": "example.go",
      "start_line": 2,
      "end_line": 2,
      "changed_span": {
        "path": "example.go",
        "start_line": 2,
        "end_line": 2,
        "side": "RIGHT"
      },
      "title": "Possible rule violation",
      "message": "Changed code must handle or return errors from calls whose failure can affect correctness or safety.",
      "evidence": {
        "kind": "rule",
        "rule_id": "correctness/ignored-error.md"
      },
      "decision": {
        "kind": "noul_probability",
        "value": 0.99
      },
      "blocking": false,
      "provider": "custom",
      "model": "jev-latest",
      "work_item_id": "<item>"
    },
    {
      "id": "<item>",
      "review_id": "<item>",
      "category": "rule_violation",
      "severity": "medium",
      "path": "example.go",
      "start_line": 2,
      "end_line": 2,
      "changed_span": {
        "path": "example.go",
        "start_line": 2,
        "end_line": 2,
        "side": "RIGHT"
      },
      "title": "Possible rule violation",
      "message": "Changed code must not pass untrusted input to a shell command without safe argument separation.",
      "evidence": {
        "kind": "rule",
        "rule_id": "security/shell-injection.md"
      },
      "decision": {
        "kind": "noul_probability",
        "value": 0.99
      },
      "blocking": false,
      "provider": "custom",
      "model": "jev-latest",
      "work_item_id": "<item>"
    }
  ],
  "skips": [],
  "stats": {
    "work_items": 1,
    "skipped": 0,
    "groups": 1,
    "batches": 1,
    "questions": 2,
    "diagnostics": 2,
    "input_tokens": 1,
    "output_tokens": 1,
    "review": {
      "request_count": 1,
      "review_duration_ms": 0
    }
  }
}
